{"results":[{"summary":"The MACD line is above the signal line, indicating bullish momentum. The RSI is also above the 50 level, indicating further bullish momentum. The stock price has been trending upwards since the start of August 1st. The Bollinger Bands are also widening, indicating increased volatility. Overall, the technical analysis indicates a strong uptrend in the stock price. However, it is important to note that past performance is not a guarantee of future performance and investors should always do their own research before making investment decisions.","movingAverages":8,"movingAveragesConvergenceDivergence":10,"relativeStrengthIndex":8,"fibonacciRetracement":7,"bollingerBands":7,"overallTrend":"upward","riskLevel":2,"overallRisk":"low","decision":"STRONG BUY","epic":"CC.D.C.USS.IP"},{"summary":"The overall trend for this stock is neutral. The moving averages, MACD, and RSI indicators are all showing mixed signals. The Fibonacci retracement indicator is showing that the stock is currently in a retracement phase. The Bollinger Bands indicator is showing that the stock is currently trading within the upper Bollinger Band. Overall, the risk level for this stock is low to medium, and the overall risk is medium. The decision on whether to buy or sell this stock should be made based on further analysis and consideration of other factors.","movingAverages":7,"movingAveragesConvergenceDivergence":7,"relativeStrengthIndex":7,"fibonacciRetracement":7,"bollingerBands":6,"overallTrend":"neutral","riskLevel":2,"overallRisk":"medium","decision":"HOLD","epic":"CC.D.C.USS.IP"},{"summary":"Based on the analysis of the given financial data, there is a suggestion to SELL CC.D.C.USS.IP. Here is the summary of the analysis done using the following methods: Moving Averages, MACD, Relative Strength Index, Fibonacci Retracement, and Bollinger Bands:\n\n* **Moving Averages:** The stock price is currently above its moving averages, indicating an upward trend. This results in a score of 8 out of 10.\n* **MACD:** The MACD line is below the signal line, indicating bearish momentum. This results in a score of 2 out of 10.\n* **Relative Strength Index:** The RSI is below 50, indicating oversold conditions. This results in a score of 6 out of 10.\n* **Fibonacci Retracement:** The stock price is below the 61.8% Fibonacci retracement level, indicating a potential for further decline. This results in a score of 4 out of 10.\n* **Bollinger Bands:** The stock price is below the lower Bollinger Band, indicating a potential for further decline. This results in a score of 4 out of 10.\n\nThe overall trend is \"downward\", the risk level is \"3\" and the overall risk is \"medium\". The final decision is to **SELL** the stock.","movingAverages":8,"movingAveragesConvergenceDivergence":2,"relativeStrengthIndex":6,"fibonacciRetracement":4,"bollingerBands":4,"overallTrend":"downward","riskLevel":3,"overallRisk":"medium","decision":"SELL","epic":"CC.D.C.USS.IP"}],"findings":{"movingAverages":8,"movingAveragesConvergenceDivergence":6,"relativeStrengthIndex":7,"fibonacciRetracement":6,"bollingerBands":6,"overallTrend":["upward","neutral","downward"],"riskLevel":2,"overallRisk":"medium","decision":["STRONG BUY","HOLD","SELL"],"epic":"CC.D.C.USS.IP"},"open_position":false,"epic":"CC.D.C.USS.IP","aiDecisions":["HOLD",["BUY","BUY","SELL","HOLD","HOLD"],"HOLD","HOLD",["STRONG BUY","HOLD","SELL"]]}