{"results":[{"summary":"Overall, the stock shows a slightly negative short term trend and a high risk level. The moving averages are suggesting a downward trend. The MACD is neutral. Momentum is strong, however RSI suggests the current price may be overbought. According to the Fibonacci analysis, the current price is at a support level of 2388. Bollinger bands indicate a high volatility in the last few days. For these reasons, a SELL decision is recommended.","movingAverages":2,"movingAveragesConvergenceDivergence":5,"relativeStrengthIndex":8,"fibonacciRetracement":7,"bollingerBands":7,"overallTrend":"downward","riskLevel":4,"overallRisk":"high","decision":"SELL","epic":"CS.D.USCGC.TODAY.IP"},{"summary":"The stock price of CS.D.USCGC.TODAY.IP has rapidly declined since August 2nd, and has not shown signs of recovery as of the last price updates on August 6th. The Moving Averages and Moving Average Convergence Divergence both indicate a strong likelihood that the stock price will continue to decrease. The Relative Strength Index is generally below 50, which suggests that the stock is oversold and could mean a potential buy opportunity. However, the Fibonacci Retracement, Bollinger Bands, and overall trend suggest that the stock will likely continue decreasing and may be headed towards a downward trend. The risk level is moderate to high, and the overall risk is medium. Overall, it is recommended to SELL or consider a STRONG SELL.","movingAverages":1,"movingAveragesConvergenceDivergence":1,"relativeStrengthIndex":4,"fibonacciRetracement":2,"bollingerBands":2,"overallTrend":"downward","riskLevel":3,"overallRisk":"medium","decision":"SELL","epic":"CS.D.USCGC.TODAY.IP"},{"summary":"The overall trend for this stock based on the selected analysis methods is slightly downwards. The moving averages are indicating the price will continue to decrease, the MACD is showing a downward trend, the RSI indicates the stock is oversold and the Bollinger bands show the price to be near the lower Bollinger band. The Fibonacci retracement indicates the price will continue to fall.\n\nThe total risk level is 3 out of 5, with an overall risk level of medium. Therefore, the recommendation is to SELL this stock.","movingAverages":7,"movingAveragesConvergenceDivergence":6,"relativeStrengthIndex":1,"fibonacciRetracement":2,"bollingerBands":4,"overallTrend":"downward","riskLevel":3,"overallRisk":"medium","decision":"SELL","epic":"CS.D.USCGC.TODAY.IP"},{"summary":"Technical analysis for CS.D.USCGC.TODAY.IP using 5 methods was conducted on the provided financial data. The Moving Averages indicator suggests a neutral trend, with a score of 5 out of 10. MACD suggests a neutral trend, with a score of 5 out of 10. RSI is neutral, with a score of 5 out of 10. Fibonacci Retracement is bullish, with a score of 8 out of 10. Bollinger Bands are bullish, with a score of 7 out of 10. Overall, the trend is neutral, with a risk level of 2 out of 5, and overall risk is medium. Given the neutral trend and medium risk, a HOLD decision is recommended.","movingAverages":5,"movingAveragesConvergenceDivergence":5,"relativeStrengthIndex":5,"fibonacciRetracement":8,"bollingerBands":7,"overallTrend":"neutral","riskLevel":2,"overallRisk":"medium","decision":"HOLD","epic":"CS.D.USCGC.TODAY.IP"}],"findings":{"movingAverages":4,"movingAveragesConvergenceDivergence":4,"relativeStrengthIndex":5,"fibonacciRetracement":5,"bollingerBands":5,"overallTrend":"downward","riskLevel":3,"overallRisk":"medium","decision":"SELL","epic":"CS.D.USCGC.TODAY.IP"},"open_position":false,"epic":"CS.D.USCGC.TODAY.IP","aiDecisions":["HOLD","HOLD","HOLD","HOLD","SELL"]}